{
  "version": 1,
  "id": "learn-to-play",
  "title": "Netrunner: System Gateway",
  "subtitle": "Community Learn to Play",
  "edition": "Forge publication proof",
  "language": "en",
  "credits": [
    "Game and card data from the versioned System Gateway fixture",
    "Publication composition generated by Forge"
  ],
  "format": {
    "width_mm": 190.5,
    "height_mm": 241.3,
    "bleed_mm": 3,
    "margin_mm": 12,
    "binding": "left",
    "facing_pages": true
  },
  "theme": {
    "paper": "#F3F0E8",
    "ink": "#161B25",
    "muted": "#596273",
    "accent": "#E05D32",
    "corp": "#23506F",
    "runner": "#6F3B73",
    "display_font": "Barlow Condensed, Arial Narrow, sans-serif",
    "body_font": "Inter, Arial, sans-serif",
    "page_number_style": "square"
  },
  "dependencies": {
    "cards": [
      "haas_bioroid_precision_design",
      "hedge_fund",
      "palisade",
      "sure_gamble",
      "wildcat_strike",
      "the_catalyst_convention_breaker"
    ],
    "setups": ["system-gateway-duel"],
    "assets": [],
    "fonts": []
  },
  "pages": [
    {
      "id": "cover",
      "name": "Cover",
      "template": "cover",
      "section": "Front matter",
      "background": { "type": "gradient", "from": "#101A27", "to": "#3C2445" },
      "show_page_number": false,
      "blocks": [
        { "id": "cover-kicker", "type": "heading", "x": 8, "y": 8, "w": 84, "h": 6, "kicker": "A LIVING CARD GAME", "content": "SYSTEM GATEWAY", "style": { "font_size_pt": 13, "color": "#E9B68F", "uppercase": true } },
        { "id": "cover-title", "type": "heading", "x": 7, "y": 19, "w": 90, "h": 22, "content": "NETRUNNER", "style": { "font_size_pt": 46, "color": "#FFFFFF", "uppercase": true } },
        { "id": "cover-subtitle", "type": "text", "x": 9, "y": 41, "w": 55, "h": 8, "content": "COMMUNITY LEARN TO PLAY", "style": { "font_size_pt": 13, "color": "#E9B68F", "uppercase": true } },
        { "id": "cover-corp", "type": "card", "x": 10, "y": 53, "w": 30, "h": 38, "card_id": "haas_bioroid_precision_design", "style": { "opacity": 0.96 } },
        { "id": "cover-runner", "type": "card", "x": 58, "y": 48, "w": 30, "h": 38, "card_id": "the_catalyst_convention_breaker", "style": { "opacity": 0.96 } },
        { "id": "cover-edition", "type": "footer", "x": 8, "y": 93, "w": 84, "h": 4, "content": "FORGE PUBLICATION PROOF  •  VERSIONED WITH THE GAME", "style": { "font_size_pt": 7, "color": "#D6DCE7", "uppercase": true } }
      ]
    },
    {
      "id": "welcome",
      "name": "Welcome to the Network",
      "template": "editorial",
      "section": "Learn",
      "accent": "#E05D32",
      "background": { "type": "paper" },
      "show_page_number": true,
      "blocks": [
        { "id": "welcome-title", "type": "heading", "x": 7, "y": 6, "w": 86, "h": 16, "kicker": "WELCOME TO THE NETWORK", "content": "Two sides. Two games. One battlefield.", "style": { "font_size_pt": 24, "color": "#161B25" } },
        { "id": "welcome-body", "type": "text", "x": 7, "y": 24, "w": 54, "h": 27, "content": "Netrunner is an asymmetric game for two players. The Corporation protects agendas behind servers and defensive ice. The Runner probes those servers, installs tools, and steals agendas before the Corporation can score them.\n\nEach side has different cards, actions, information, and risks. Learning the game means learning how those two systems collide.", "style": { "font_size_pt": 10, "columns": 2 } },
        { "id": "welcome-goal", "type": "callout", "x": 65, "y": 24, "w": 28, "h": 21, "heading": "THE SHARED GOAL", "content": "Be the first player to reach 7 agenda points. The Corporation scores installed agendas. The Runner steals agendas by accessing them.", "style": { "font_size_pt": 9, "background": "#E8E2D7", "border": "#E05D32", "padding_mm": 4, "radius_mm": 2 } },
        { "id": "welcome-contents", "type": "component-list", "x": 7, "y": 55, "w": 42, "h": 34, "heading": "IN THIS BOOK", "items": ["Build the first table", "Read cards and spend clicks", "Create and protect servers", "Make a run", "Resolve access", "Use the quick reference"], "style": { "font_size_pt": 9 } },
        { "id": "welcome-cards", "type": "card-grid", "x": 52, "y": 48, "w": 41, "h": 43, "card_ids": ["hedge_fund", "sure_gamble"], "caption": "Every example is linked to the exact card version in this commit.", "style": { "background": "#DCE2E6", "padding_mm": 3, "radius_mm": 2 } }
      ]
    },
    {
      "id": "components",
      "name": "Components and First Decks",
      "template": "editorial",
      "section": "Setup",
      "accent": "#23506F",
      "background": { "type": "paper" },
      "show_page_number": true,
      "blocks": [
        { "id": "components-title", "type": "heading", "x": 7, "y": 6, "w": 86, "h": 16, "kicker": "BEFORE THE FIRST CLICK", "content": "Components & tutorial decks", "style": { "font_size_pt": 22 } },
        { "id": "components-list", "type": "component-list", "x": 7, "y": 22, "w": 37, "h": 40, "heading": "WHAT YOU NEED", "items": ["One Corporation deck", "One Runner deck", "Two identity cards", "Agenda, credit, click, tag, damage, power, and virus counters", "A score area for each player", "Room between the players for remote servers"], "style": { "font_size_pt": 9, "background": "#E7E4DC", "padding_mm": 4, "radius_mm": 2 } },
        { "id": "components-identity", "type": "card-grid", "x": 47, "y": 22, "w": 46, "h": 41, "card_ids": ["haas_bioroid_precision_design", "the_catalyst_convention_breaker"], "caption": "Identity cards begin faceup and define deckbuilding limits and abilities.", "style": { "padding_mm": 3 } },
        { "id": "components-setup", "type": "steps", "x": 7, "y": 67, "w": 86, "h": 24, "heading": "SET UP THE FIRST GAME", "items": ["Choose sides and place both identities faceup.", "Shuffle each deck. The Corporation draws five cards; the Runner draws five.", "Give each player 5 credits. Put the Corporation's HQ, R&D, and Archives in a row.", "Keep the central play area open. New remote servers will be built there during play."], "style": { "font_size_pt": 8.5, "columns": 2, "background": "#E4EBEF", "padding_mm": 4, "radius_mm": 2 } }
      ]
    },
    {
      "id": "table-state",
      "name": "Game in Progress",
      "template": "diagram",
      "section": "Setup",
      "background": { "type": "split" },
      "show_page_number": true,
      "blocks": [
        { "id": "table-title", "type": "heading", "x": 5, "y": 4, "w": 90, "h": 12, "kicker": "GAME IN PROGRESS", "content": "Read the table before reading a rule", "style": { "font_size_pt": 18, "color": "#FFFFFF" } },
        {
          "id": "table-scene",
          "type": "scene",
          "x": 4,
          "y": 16,
          "w": 92,
          "h": 65,
          "caption": "A version-controlled setup scene: cards, backs, labels, orientations, and arrows are all linked data.",
          "placements": [
            { "id": "corp-id", "kind": "card", "card_id": "haas_bioroid_precision_design", "x": 3, "y": 4, "w": 15, "h": 31, "rotate": 0, "z": 2 },
            { "id": "hq", "kind": "card-back", "x": 25, "y": 4, "w": 12, "h": 26, "rotate": 0, "z": 1, "label": "HQ" },
            { "id": "rd", "kind": "card-back", "x": 43, "y": 4, "w": 12, "h": 26, "rotate": 0, "z": 1, "label": "R&D" },
            { "id": "archives", "kind": "card-back", "x": 61, "y": 4, "w": 12, "h": 26, "rotate": 0, "z": 1, "label": "ARCHIVES" },
            { "id": "remote-ice", "kind": "card", "card_id": "palisade", "x": 78, "y": 8, "w": 13, "h": 28, "rotate": 90, "z": 2 },
            { "id": "remote-card", "kind": "card-back", "x": 79, "y": 37, "w": 12, "h": 26, "rotate": 0, "z": 1, "label": "REMOTE" },
            { "id": "runner-id", "kind": "card", "card_id": "the_catalyst_convention_breaker", "x": 3, "y": 61, "w": 15, "h": 31, "rotate": 0, "z": 2 },
            { "id": "runner-event", "kind": "card", "card_id": "sure_gamble", "x": 31, "y": 62, "w": 13, "h": 28, "rotate": 0, "z": 2 },
            { "id": "runner-label", "kind": "label", "x": 52, "y": 72, "w": 35, "h": 10, "rotate": 0, "z": 3, "label": "RUNNER RIG & PLAY AREA", "tone": "#D8B7DE" }
          ],
          "arrows": [
            { "x1": 83, "y1": 67, "x2": 83, "y2": 38, "label": "RUN", "tone": "#E8B1F0" },
            { "x1": 70, "y1": 30, "x2": 82, "y2": 28, "label": "PROTECTS", "tone": "#BBDFF5" }
          ],
          "style": { "background": "#111827", "border": "#6B7C92", "padding_mm": 2, "radius_mm": 2 }
        },
        { "id": "table-note", "type": "callout", "x": 5, "y": 84, "w": 90, "h": 11, "heading": "WHY THIS MATTERS", "content": "If Palisade changes, Forge can flag this scene and rebuild the exact page instead of leaving a stale screenshot in a private design file.", "style": { "font_size_pt": 8.5, "background": "#E6E1D9", "border": "#E05D32", "padding_mm": 3, "radius_mm": 2 } }
      ]
    },
    {
      "id": "cards-clicks",
      "name": "Cards, Costs and Clicks",
      "template": "editorial",
      "section": "Core concepts",
      "accent": "#6F3B73",
      "background": { "type": "paper" },
      "show_page_number": true,
      "blocks": [
        { "id": "click-title", "type": "heading", "x": 7, "y": 6, "w": 86, "h": 12, "kicker": "BASIC CONCEPTS", "content": "Cards, costs & clicks", "style": { "font_size_pt": 26 } },
        { "id": "click-card", "type": "card", "x": 8, "y": 20, "w": 33, "h": 52, "card_id": "wildcat_strike", "caption": "A linked live card, not a pasted screenshot.", "style": { "background": "#E3DCE5", "padding_mm": 3, "radius_mm": 2 } },
        { "id": "click-cost", "type": "callout", "x": 47, "y": 19, "w": 46, "h": 18, "heading": "1 — PAY THE COST", "content": "The number beside the credit symbol is the install or play cost. Spend that many credits from your pool.", "style": { "font_size_pt": 9, "background": "#EAE6DE", "border": "#6F3B73", "padding_mm": 4, "radius_mm": 2 } },